occupent nos esprits et travaillent nos corps,Okyp@nozEspRi|etRavaj@nokOR.,12
comme les mendiants nourrissent leur vermine,kOm@lemAdjA|nuRis@l9RvERmin.,12
c'est que notre âme hélas  n'est pas assez hardie,sEk@nOtRamelas|n|EpazaseaRdi.,12
ils mêlent de la cendre avec d'impurs crachats ,ilmEl@d@lasAdR|avEkdte~pyRkRaSa.,12
avec hypocrisie ils jettent ce qu'il touche,avEkipOkRizi|ilZEt@s@kiltuS.,12
et s'accusent d'avoir mis leurs pieds dans ses pas,eszakyz@dtavwaR|mil9RpjedAsepa.,12
lui dérobent l'aspect des peuples furieux ,lHideROb@laspE|dep9pl@fyRj2.,12
prennent des albatros vastes oiseaux des mers,pREn@dezalbatRos|vast@zwazodemER.,12
ses ailes de géant l'empêchent de marcher,sezEl@d@ZeA|l|ApES@d@maRSe.,12
qui chargent de leur poids l'existence brumeuse,kiSaRZ@d@l9Rpwa|l|EgzistAs@bRym2z.,12
laissent parfois sortir de confuses paroles ,lEs@paRfwasORtiR|d@kCfyz@paROl.,12
qui chantent les transports de l'esprit et des sens,kiSAt@letRAspOR|d@lEspRitedesA.,12
déchirent leur suaire en étirant leurs doigts ,deSiR@l9RsHER|AetiRAl9Rdwa.,12
qui versent la folie à ce bal tournoyant ,kivERs@lafOli|as@baltuRnwajA.,12
passent comme un soupir étouffé de weber ,pas@kOme~supiR|etufed@vEbER.,12
où règnent tour à tour le père des chansons,uREnj@tuRatuR|l@pER@deSAsC.,12
aux nocturnes rayons qui percent les volets ,onOktyRn@REjC|kipERs@levOlE.,12
c'est vous lady macbeth âme puissante au crime,sEvulEdimakbet|am@pHisAtokRim.,12
aux humides brouillards qui nagent dans ses yeux ,oymid@bRujaR|kinaZ@dAsezj2.,12
l'élégance et la force abondent sœurs divines,lelegAselafORs|abCd@s2Rdivin.,12
ton mensonge m'enivre et mon âme s'abreuve,tCmAsCZ@mAnivR|emCam@szabR9v.,12
si ton œil ton souris ton pied m'ouvrent la porte,sitC2jtCsuRi|tCpjemuvR@lapORt.,12
qu'éblouissent les feux d'un soleil monotone ,kebluis@lef2|dt|e~sOlEjmOnOtOn.,12
comme d'autres esprits voguent sur la musique,kOm@dtotR@zEspRi|vOg@syRlamyzik.,12
un port retentissant où mon âme peut boire,e~pORR@tAtisAt|umCam@p2bwaR.,12
ouvrent leurs vastes bras pour embrasser la gloire,uvR@l9Rvast@bRa|puRAbRaselaglwaR.,12
qui séparent mes bras des immensités bleues,kisepaR@mebRa|dezimAsitebl2.,12
femme impure  l'ennui rend ton âme cruelle,fame~pyR@lAnHi|RAtCam@kRyEl.,12
usent insolemment d'un pouvoir emprunté,yzte~solamA@|dt|e~puvwaRApRe~te.,12
tes yeux sont la citerne où boivent mes ennuis,tezj2sClasitERn|ubwav@mezAnHi.,12
où nagent dans la nuit l'horreur et le blasphème ,unaZ@dAlanHi|l|OR9Rel@blasfEm.,12
qui peuvent se plonger dans un sommeil stupide,kip9v@s@plCZe|dAze~sOmEjstypid.,12
de n'avoir pas connu ce que pleurent les morts  ,d@navwaRpakOny|s@k@pl9R@lemOR.,12
vengent bientôt l'épée et la dague traîtresse,vAZ@bje~tolepe|eladag@tREtREs.,12
ils marchent devant moi ces yeux pleins de lumières,ilmaRS@d@vAmwa|sezj2ple~d@lymjER.,12
ils marchent ces divins frères qui sont mes frères,ilmaRS@sedive~|fRER@kisCmefRER.,12
ils conduisent mes pas dans la route du beau ,ilkCdHiz@mepa|dAlaRut@dybo.,12
ils célèbrent la mort vous chantez le réveil ,ilselEbR@lamOR|vuSAtel@RevEj.,12
qui compriment le cœur comme un papier qu'on froisse ,kikCpRim@l@k9r|kOme~papjekCfRwas.,12
dans des yeux où longtemps burent nos yeux avides ,dAdezj2zulCtA|byR@nozj2zavid.,12
âme resplendissante à l'immortel soleil ,am@REsplAdisAt|alimORtElsOlEj.,12
les sons et les parfums tournent dans l'air du soir ,lesCzelepaRfe~|tuRn@dAlERdyswaR.,12
est poreuse on dirait qu'ils pénètrent le verre,EpOR2zCdiRE|k|ilpenEtR@l@vER.,12
qui dégagent leur aile et prennent leur essor,kidegaZ@l9REl|epREn@l9ResOR.,12
saisit l'âme vaincue et la pousse à deux mains,sezilam@ve~ky|elapusad2me~.,12
lacs où mon âme tremble et se voit à l'envers,lakzumCam@tRAbl|es@vwatalAvER.,12
qui plonge dans l'oubli mon âme sans remord,kiplCZ@dAlubli|mCam@sAR@moR.,12
les nerfs trop éveillés raillent l'esprit qui dort,lenERtRoeveje|Raj@lEspRikidOR.,12
qu'allument les soleils des brumeuses saisons,kalym@lesOlEj|debRym2z@sEzC.,12
qu'enflamment les rayons tombant d'un ciel brouillé ,kAflam@leREjC|tCbAdte~sjElbRuje.,12
les diverses beautés qui parent ta jeunesse ,ledivERs@bote|kipaR@taZ9nEs.,12
les diverses beautés qui parent ta jeunesse ,ledivERs@bote|kipaR@taZ9nEs.,12
tourmentent les désirs obscurs et les agacent,tuRmAt@ledeziRz|OpskyRzelezagas.,12
tes bras qui se joueraient des précoces hercules,tebRakis@ZuRE@depRekOsERkyl.,12
et pareil au mourant qu'écrasent les blessés,epaREjomuRA|k|ekRaz@leblese.,12
ils me disent tes yeux clairs comme le cristal ,ilm@diz@tezj2|klERkOm@l@kRistal.,12
qui montent dans l'azur comme des floraisons,kimCt@dAlazyR|kOm@deflOREzC.,12
aiment également dans leur mûre saison,Emtegal@mA@|dAl9RmyR@sEzC.,12
ils cherchent le silence et l'horreur des ténèbres ,ilSERS@l@silAs|elOR9RdetenEbR.,12
qui semblent s'endormir dans un rêve sans fin ,kisAbl@szAdORmiR|dAze~REv@sAfe~.,12
me bercent  d'autre fois calme plat grand miroir,m@bERs@dtotR@fwa|kalm@plagRAmiRwaR.,12
au travers de l'espace ils s'enfoncent tous deux,otRavERd@lEspas|ilszAfCs@tusd2.,12
et foulent l'infini d'un sabot hasardeux,eful@le~fini|dt|e~saboazaRd2.,12
 mais les buveurs heureux connaissent leur vainqueur,mElebyv9R2R2|kOnEs@l9Rve~k9R.,12
l'âme d'un vieux poëte erre dans la gouttière,lam@dte~vj2poEt|ER@dAlagutjER.,12
où comme des remords se traînent de longs vers,ukOm@deR@mOR|s@tREn@d@lCvER.,12
qui s'acharnent toujours sur mes morts les plus chers,kiszaSaRn@tuZuR|syRmemORleplySER.,12
seuls respirent l'odeur d'un flacon débouché,s9lREspiR@lOd9R|dt|e~flakCdebuSe.,12
ne savent plus trouver d'impudique toilette,n@sav@plytRuve|dt|e~pydik@twalEt.,12
et lancent vers le ciel un affreux hurlement,elAs@vERl@sjEl|e~afR2yRl@mA.,12
chambres d'éternel deuil où vibrent de vieux râles,SAbR@dtetERnEld9j|uvibR@d@vj2Ral.,12
répondent les échos de vos de profundis,RepCd@lezeko|d@vod@pRofundis.,12
où vivent jaillissant de mon œil par milliers,uviv@ZajisA|d@mC2jpaRmilje.,12
jamais  jamais  à ceux qui s'abreuvent de pleurs,ZamEZamEzas2|kiszabR9v@d@pl9R.,12
et tettent la douleur comme une bonne louve ,etEt@ladul9R|kOmyn@bOn@luv.,12
les mystères partout coulent comme des sèves,lemistER@paRtu|kul@kOm@desEv.,12
et que décor semblable à l'âme de l'acteur,ek@dekORsAblabl|alam@d@lakt9R.,12
et discutant avec mon âme déjà lasse,ediskytAtavEk|mCam@deZalas.,12
ces sept monstres hideux avaient l'air éternel ,sesEtmCstRid2zavE@lERetERnEl.,12
et mon âme dansait dansait vieille gabarre,emCam@dAsE|dAsEvjEj@gabaR.,12
ces monstres disloqués furent jadis des femmes,semCstR@dislOke|fyR@Zadisdefam.,12
ils rampent flagellés par les bises iniques,ilRAp@flaZele|paRlebiz@zinik.,12
ils trottent tout pareils à des marionnettes ,iltROt@tupaREjz|ademaRjOnEt.,12
se traînent comme font les animaux blessés,s@tREn@kOm@fC|lezanimoblese.,12
ou dansent sans vouloir danser pauvres sonnettes,udAs@sAvulwaR|dAsepovR@sOnEt.,12
toutes m'enivrent  mais parmi ces êtres frêles,tut@mAnivR@mE|paRmiseEtR@fREl.,12
dont les soldats parfois inondent nos jardins,dClesOldapaRfwaz|inCd@noZaRde~.,12
versent quelque héroïsme au cœur des citadins,vERs@kElkeROism|ok9rdesitade~.,12
mon âme resplendit de toutes vos vertus ,mCam@REsplAdi|d@tut@vovERty.,12
comme s'ils regardaient au loin restent levés,kOm@szilR@gaRdEt|olwe~REst@l@ve.,12
dont les bras sans mentir peuvent dire  aujourd'hui,dClebRasAmAtiR|p9v@diRojuRdji.,12
s'emplissent de catins et d'escrocs leurs complices,szAplis@d@kate~z|edtEskRol9RkCplis.,12
au coin du feu le soir auprès d'une âme aimée,okwe~dyf2l@swaR|opREdtynameme.,12
qui viennent gaspiller leurs sanglantes sueurs ,kivjEn@gaspije|l9RsAglAt@sH9R.,12
qui ne comprennent pas amants ivres de chair,kin@kCpREn@paz|amAzivR@d@SER.,12
les charmes de l'horreur n'enivrent que les forts ,leSaRm@d@lOR9R|n|AnivR@k@lefOR.,12
qui ne recèlent point de secrets précieux ,kin@R@sEl@pwe~|d@s@kREpResj2.,12
certe ils doivent trouver les vivants bien ingrats,sErtildwav@tRuve|levivAbje~e~gRa.,12
ils sentent s'égoutter les neiges de l'hiver,ilsAt@szegute|lenEZ@d@livER.,12
mon âme mieux qu'au temps du tiède renouveau,mCam@mj2kotA|dytjEd@R@nuvo.,12
et sur qui dès longtemps descendent les frimas,esyRkidElCtA|desAd@lefRima.,12
où l'âme sous le poids du corps revêche et lourd,ulam@sul@pwa|dykORR@vESeluR.,12
s'aggravent les douleurs des femmes en gésine ,szagRav@ledul9R|defam@zAZezin.,12
un soir l'âme du vin chantait dans les bouteilles ,e~swaRlam@dyve~|SAtEdAlebutEj.,12
reviennent parfumés d'une odeur de futailles,R@vjEn@paRfyme|dt|ynOd9Rd@fytaj.,12
se dressent devant eux solennelle magie ,s@dREs@d@vAt2|sOlanEl@maZi.,12
ils apportent la gloire au peuple ivre d'amour ,ilzapORt@laglwaR|op9plivR@dtamuR.,12
qui se jettent sans peur dans les gouffres sans fonds,kis@ZEt@sAp9R|dAlegufR@sAfC.,12
et courent sanglotant et gloussant par saccades,ekuR@sAglOtAt|eglusApaRsakad.,12
caressent les fruits mûrs de leur nubilité ,kaREs@lefRHimyR|d@l9Rnybilite.,12
que nous veulent les lois du juste et de l'injuste ,k@nuv9l@lelwa|dyZysted@le~Zyst.,12
que nous veulent les lois du juste et de l'injuste ,k@nuv9l@lelwa|dyZysted@le~Zyst.,12
dont les formes au loin frissonnent dans l'azur ,dClefORm@zolwe~|fRisOn@dAlazyR.,12
que poussent vers les cieux ses rivages déserts,k@pus@vERlesj2|seRivaZ@dezER.,12
qui caressent le soir les grands lacs transparents,kikaREs@l@swaR|legRAlaktRAspaRA.,12
qui veulent me conduire en des routes mouvantes,kiv9l@m@kCdHiR|AdeRut@muvAt.,12
que nos rideaux fermés nous séparent du monde,k@noRidofERme|nusepaR@dymCd.,12
et pénètrent vos corps de leurs parfums affreux,epenEtR@vokOR|d@l9RpaRfe~zafR2.,12
elles tournent leurs yeux vers l'horizon des mers,El@tuRn@l9Rzj2|vERlORizCdemER.,12
dans le fond des bosquets où jasent les ruisseaux,dAl@fCdebOskEz|uZaz@leRHiso.,12
et creusent le bois vert des jeunes arbrisseaux ,ekR2z@l@bwavER|deZ9n@zaRbRiso.,12
d'autres comme des sœurs marchent lentes et graves,dtotR@kOm@des2R|maRS@lAt@zegRav.,12
mêlent dans le bois sombre et les nuits solitaires,mEl@dAl@bwasCbR|elenHisOlitER.,12
tombeaux et lupanars montrent sous leurs charmilles,tCbozelypanaR|mCtR@sul9RSaRmij.,12
nous offrent tour à tour comme deux bonnes sœurs,nuzOfR@tuRatuR|kOm@d2bOn@s2R.,12
et dans ses bras ouverts que remplissent ses seins,edAsebRazuvER|k@RAplis@sese~.,12
que sur ces matelas qui se pâment d'émoi,k@syRsemat@la|kis@pam@dtemwa.,12
roulent comme l'encens sur un jardin de roses,Rul@kOm@lAsA|syRe~ZaRde~d@Roz.,12
où tu foulais monté sur une douce ânesse,utyfulEmCte|syRyn@dusanEs.,12
nous userons notre âme en de subtils complots,nuzyz@RCnOtRam|Ad@syptilkCplo.,12
et sans savoir pourquoi disent toujours  allons ,esAsavwaRpuRkwa|diz@tuZuRzalC.,12
notre âme est un trois-mâts cherchant son icarie ,nOtRamEte~tRwama|SERSAsCikari.,12
tes branches veulent voir le soleil de plus près ,tebRAS@v9l@vwaR|l@sOlEjd@plypRE.,12
qui savent le tuer sans quitter leur berceau,kisav@l@tHe|sAkitel9RbERso.,12
qui chantent   par ici  vous qui voulez manger,kiSAt@paRisi|vukivulemAZe.,12
nos pylades là-bas tendent leurs bras vers nous,nopilad@laba|tAd@l9RbRavERnu.,12
je traîne des serpents qui mordent mes souliers,Z@tREn@desERpA|kimORd@mesulje.,12
vers l'étrange et l'absurde invitent sa raison ,vERletRAZelapsyRd|e~vit@saREzC.,12
voilà bien ton emblème âme aux songes obscurs,vwalabje~tCAblEm|amosCZ@zOpskyR.,12
mon âme dans tes mains n'est pas un vain jouet,mCam@dAteme~|n|Epaze~ve~ZwE.,12
tous virent le signal et l'immense fumée,tusviR@l@sinjal|elimAs@fyme.,12
par les quatre côtés d'où soufflent les haleines,paRlekatR@kote|dt|usufl@lealEn.,12
vinrent docilement à la carrière rouge,ve~R@dOsil@mAt|alakaRjER@RuZ.,12
lavent dans le ruisseau les couleurs de la guerre,lav@dAl@RHiso|lekul9Rd@lagER.,12
chacun s'en retourna l'âme calme et ravie,Sake~szAR@tuRna|l|am@kalmeRavi.,12
le tout-puissant montait content de son ouvrage,l@tupHisAmCtE|kCt@d@sCuvRaZ.,12
la sottise l'erreur le péché la lésine,lasOtiz@leR9R|l@peSelalezin.,12
et nous alimentons nos aimables remords,enuzalimAtC|nozEmabl@R@mOR.,12
nos péchés sont têtus nos repentirs sont lâches ,nopeSesCtety|noR@pAtiRsClaS.,12
nous nous faisons payer grassement nos aveux,nunuf@zCpeje|gRas@mAnozav2.,12
et nous rentrons gaîment dans le chemin bourbeux,enuRAtRCgEmA|dAl@S@me~buRb2.,12
croyant par de vils pleurs laver toutes nos taches,kRwajApaRd@vilpl9R|lavetut@notaS.,12
sur l'oreiller du mal c'est satan trismégiste,syRlORejedymal|s|EsatAtRismeZist.,12
qui berce longuement notre esprit enchanté,kibERs@lCg@mA|nOtREspRitASAte.,12
et le riche métal de notre volonté,el@RiS@metal|d@nOtR@vOlCte.,12
est tout vaporisé par ce savant chimiste,EtuvapORize|paRs@savASimist.,12
c'est le diable qui tient les fils qui nous remuent ,sEl@djabl@ki|tje~lefilkinuR@my.,13
aux objets répugnants nous trouvons des appas ,ozObZERepynjA|nutRuvCdezapa.,12
chaque jour vers l'enfer nous descendons d'un pas,Sak@ZuRvERlAfER|nudesAdCdte~pa.,12
sans horreur à travers des ténèbres qui puent,sAOR9RatRavER|detenEbR@kipy.,12
ainsi qu'un débauché pauvre qui baise et mange,e~sike~deboSe|povR@kibEzemAZ.,12
le sein martyrisé d'une antique catin,l@se~maRtiRize|dt|ynAtik@kate~.,12
nous volons au passage un plaisir clandestin,nuvOlCzopasaZ|e~pleziRklAdEste~.,12
que nous pressons bien fort comme une vieille orange,k@nupResCbje~fOR|kOmyn@vjEjORAZ.,12
serré fourmillant comme un million d'helminthes,seRefuRmijAkOm|e~miljCdElme~t.,12
dans nos cerveaux ribote un peuple de démons,dAnosERvoRibot|e~p9pl@d@demC.,12
et quand nous respirons la mort dans nos poumons,ekAnuREspiRC|lamORdAnopumC.,12
descend fleuve invisible avec de sourdes plaintes,desAfl9ve~vizibl|avEkd@suRd@ple~t.,12
si le viol le poison le poignard l'incendie,sil@vjOll@pwazCl@pwanjaRle~sAdi.,13
n'ont pas encor brodé de leurs plaisants dessins,nCpazAkorbROde|d@l9RplEzAdese~.,12
le canevas banal de nos piteux destins,l@kan@vabanal|d@nopit2dEste~.,12
mais parmi les chacals les panthères les lices,mEpaRmileSakal|lepAtER@lelis.,12
les singes les scorpions les vautours les serpents,lese~Z@leskORpjClevotuRlesERpA.,13
les monstres glapissants hurlants grognants rampants,lemCstR@glapisA|yRlAgRoJARApA.,12
dans la ménagerie infâme de nos vices,dAlamenaZ@Ri|e~fam@d@novis.,12
il en est un plus laid plus méchant plus immonde ,ilAEte~plylE|plymeSAplyzimCd.,12
quoiqu'il ne pousse ni grands gestes ni grands cris,kwakiln@pus@ni|gRAZEst@nigRAkRi.,12
il ferait volontiers de la terre un débris,ilf@REvOlCtje|d@latERe~debRi.,12
et dans un bâillement avalerait le monde ,edAze~baj@mAt|aval@REl@mCd.,12
c'est l'ennui   l'œil chargé d'un pleur involontaire,sElAnHil2jSaRZe|dt|e~pl9Re~vOlCtER.,12
il rêve d'échafauds en fumant son houka,ilREv@dteSafoz|AfymAsCuka.,12
tu le connais lecteur ce monstre délicat,tyl@kOnElEkt9R|s@mCstR@delika.,12
 hypocrite lecteur  mon semblable  mon frère ,ipOkRit@lEkt9R|mCsAblabl@mCfRER.,12
lorsque par un décret des puissances suprêmes,lORsk@paRe~dekRE|depHisAs@sypREm.,12
le poëte apparaît en ce monde ennuyé,l@poEtapaREt|As@mCdAnHije.,12
sa mère épouvantée et pleine de blasphèmes,samERepuvAte|eplEn@d@blasfEm.,12
crispe ses poings vers dieu qui la prend en pitié ,kRisp@sepwe~vERdj2|kilapRAtApitje.,12
  ah  que n'ai-je mis bas tout un nœud de vipères,ak@neZ@miba|tute~n2d@vipER.,12
plutôt que de nourrir cette dérision ,plytok@d@nuRiR|sEt@deRizjC.,12
maudite soit la nuit aux plaisirs éphémères,modit@swalanHit|opleziRzefemER.,12
où mon ventre a conçu mon expiation ,umCvAtRakCsy|mCEkspjasjC.,12
puisque tu m'as choisie entre toutes les femmes,pHisk@tymasSwazi|AtR@tut@lefam.,12
pour être le dégoût de mon triste mari,puREtR@l@degu|d@mCtRist@maRi.,12
et que je ne puis pas rejeter dans les flammes,ek@Z@n@pHipa|R@Z@tedAleflam.,12
comme un billet d'amour ce monstre rabougri,kOme~bijEdtamuR|s@mCstR@RabugRi.,12
je ferai rejaillir ta haine qui m'accable,Z@f@ReR@ZajiR|taEn@kimakabl.,12
sur l'instrument maudit de tes méchancetés,syRle~stRymAmodi|d@temeSAs@te.,12
et je tordrai si bien cet arbre misérable,eZ@tORdResibje~|sEttaRbR@mizeRabl.,12
qu'il ne pourra pousser ses boutons empestés  ,kiln@puRapuse|sebutCzApEste.,12
elle ravale ainsi l'écume de sa haine,El@Ravale~si|l|ekym@d@saEn.,12
et ne comprenant pas les desseins éternels,en@kCpR@nApa|ledese~zetERnEl.,12
elle-même prépare au fond de la géhenne,El@mEm@pRepaR|ofCd@laZeEn.,12
les bûchers consacrés aux crimes maternels,lebySekCsakRez|okRim@matERnEl.,12
pourtant sous la tutelle invisible d'un ange,puRtAsulatytEl|e~vizibl@dte~AZ.,12
l'enfant déshérité s'enivre de soleil,lAfAdezeRite|sz|AnivR@d@sOlEj.,12
et dans tout ce qu'il boit et dans tout ce qu'il mange,edAtus@kilbwat|edAtus@kilmAZ.,12
retrouve l'ambroisie et le nectar vermeil,R@tRuv@lAbRwazi|el@nEktaRvERmEj.,12
il joue avec le vent cause avec le nuage,ilZuavEkl@vA|kozavEkl@nHaZ.,12
et s'enivre en chantant du chemin de la croix ,eszAnivRASAtA|dyS@me~d@lakRwa.,12
et l'esprit qui le suit dans son pèlerinage,elEspRikil@sHi|dAsCpEl@RinaZ.,12
pleure de le voir gai comme un oiseau des bois,pl9R@d@l@vwaRge|kOme~wazodebwa.,12
tous ceux qu'il veut aimer l'observent avec crainte,tuss2kilv2teme|l|OpsERvtavEkkRe~t.,11
ou bien s'enhardissant de sa tranquillité,ubje~szAaRdisA|d@satRAkilite.,12
cherchent à qui saura lui tirer une plainte,SERStakisoRalHi|tiReyn@ple~t.,11
et font sur lui l'essai de leur férocité,efCsyRlHilesE|d@l9RfeROsite.,12
dans le pain et le vin destinés à sa bouche,dAl@pe~el@ve~|dEstinezasabuS.,12
sa femme va criant sur les places publiques ,safam@vakRijAsyRleplas@pyblik.,13
  puisqu'il me trouve assez belle pour m'adorer,pjiskilm@tRuvase|bEl@puRmadORe.,12
je ferai le métier des idoles antiques,Z@f@Rel@metje|dezidOl@zAtik.,12
et comme elles je veux me faire redorer ,ekOmEl@Z@v2|m@fER@R@dore.,12
et je me soûlerai de nard d'encens de myrrhe,eZ@m@sul@Re|d@naRdtAsAd@miR.,12
de génuflexions de viandes et de vins,d@ZenyflEksjC|d@vjAd@zed@ve~.,13
pour savoir si je puis dans un cœur qui m'admire,puRsavwaRsiZ@pHi|dAze~k9rkimadmiR.,12
usurper en riant les hommages divins ,yzyRpeARjA|leOmaZ@dive~.,12
et quand je m'ennuîrai de ces farces impies,ekAZ@menjiRE|d@sefaRs@ze~pi.,12
je poserai sur lui ma frêle et forte main ,Z@poz@ResyRlHi|mafRElefORt@me~.,12
et mes ongles pareils aux ongles des harpies,emezCgl@paREjz|ozCgl@deaRpi.,12
sauront jusqu'à son cœur se frayer un chemin,soRCZyskasCk9r|s@fRejee~S@me~.,12
comme un tout jeune oiseau qui tremble et qui palpite,kOme~tuZ9nwazo|kitRAblekipalpit.,12
j'arracherai ce cœur tout rouge de son sein,ZaRaS@Res@k9r|tuRuZ@d@sCse~.,12
et pour rassasier ma bête favorite,epuRRasazje|mabEt@favORit.,12
je le lui jetterai par terre avec dédain  ,Z@l@lHiZEt@Re|paRtERavEkdede~.,12
vers le ciel où son œil voit un trône splendide,vERl@sjElusC2j|vwate~tRon@splAdid.,12
le poëte serein lève ses bras pieux,l@poEt@s@Re~|lEv@sebRapj2.,12
et les vastes éclairs de son esprit lucide,elevast@zeklER|d@sCEspRilysid.,12
  soyez béni mon dieu qui donnez la souffrance,swajebenimCdj2|kidOnelasufRAs.,12
comme un divin remède à nos impuretés,kOme~dive~R@mEd|anoze~pyR@te.,12
et comme la meilleure et la plus pure essence,ekOm@lamEj2R|elaplypyResAs.,12
qui prépare les forts aux saintes voluptés ,kipRepaR@lefORz|ose~t@vOlypte.,12
je sais que vous gardez une place au poëte,Z@sEk@vugaRde|yn@plasopoEt.,12
dans les rangs bienheureux des saintes légions,dAleRAbje~n9R2|dese~t@leZjC.,12
et que vous l'invitez à l'éternelle fête,ek@vule~vite|aletERnEl@fEt.,12
des trônes des vertus des dominations,detRon@devERty|dedOminasjC.,12
je sais que la douleur est la noblesse unique,Z@sEk@ladul9R|ElanOblEsynik.,12
où ne mordront jamais la terre et les enfers,un@mORdRCZamE|latERelezAfER.,12
et qu'il faut pour tresser ma couronne mystique,ekilfopuRtRese|makuROn@mistik.,12
imposer tous les temps et tous les univers,e~pozetusletAz|etuslezynivER.,12
mais les bijoux perdus de l'antique palmyre,mElebiZupERdy|d@lAtik@palmiR.,12
les métaux inconnus les perles de la mer,lemetoze~kOny|lepERl@d@lamER.,12
par votre main montés ne pourraient pas suffire,paRvOtR@me~mCte|n@puREpasyfiR.,12
à ce beau diadème éblouissant et clair ,as@bodjadEm|ebluisAteklER.,12
car il ne sera fait que de pure lumière,kaRiln@s@RafE|k@d@pyR@lymjER.,12
puisée au foyer saint des rayons primitifs,pHizeofwajese~|deREjCpRimitif.,12
et dont les yeux mortels dans leur splendeur entière,edClezj2mORtEl|dAl9RsplAd9RAtjER.,12
ne sont que des miroirs obscurcis et plaintifs ,n@sCk@demiRwaRz|OpskyRsizeple~tif.,12
souvent pour s'amuser les hommes d'équipage,suvApuRszamyze|leOm@dtekipaZ.,12
qui suivent indolents compagnons de voyage,kisHivte~dOlAkCpanjCd@vwajaZ.,11
le navire glissant sur les gouffres amers,l@naviR@glisA|syRlegufR@zamER.,12
a peine les ont-ils déposés sur les planches,apEn@lezCtil|depozesyRleplAS.,12
que ces rois de l'azur maladroits et honteux,k@seRwad@lazyR|maladRwazeCt2.,12
laissent piteusement leurs grandes ailes blanches,lEspit2z@mAl9R|gRAd@zEl@blAS.,11
comme des avirons traîner à côté d'eux,kOm@dezaviRC|tReneakotedt2.,12
ce voyageur ailé comme il est gauche et veule ,s@vwajaZ9Rele|kOmilEgoSev2l.,12
lui naguère si beau qu'il est comique et laid ,lHinagER@sibo|k|ilEkOmikelE.,12
l'un agace son bec avec un brûle-gueule,le~agas@sCbEk|avEke~bRyl@g9l.,12
l'autre mime en boitant l'infirme qui volait ,lotR@mimAbwatA|l|e~fiRm@kivOlE.,12
le poëte est semblable au prince des nuées,l@poEtEsAblabl|opRe~s@denHe.,12
qui hante la tempête et se rit de l'archer ,kiAt@latApEt|es@Rid@laRSe.,12
exilé sur le sol au milieu des huées,EgzilesyRl@sOl|omilj2deHe.,12
au-dessus des étangs au-dessus des vallées,od@sydezetAz|od@sydevale.,12
des montagnes des bois des nuages des mers,demCtanj@debwa|denHaZ@demER.,12
par delà le soleil par delà les éthers,paRd@lal@sOlEj|paRd@lalezetER.,12
par delà les confins des sphères étoilées,paRd@lalekCfe~|desfER@zetwale.,12
mon esprit tu te meus avec agilité,mCEspRityt@m2z|avEkaZilite.,12
et comme un bon nageur qui se pâme dans l'onde,ekOme~bCnaZ9R|kis@pam@dAlCd.,12
tu sillonnes gaîment l'immensité profonde,tysijOn@gEmA|l|imAsitepROfCd.,12
avec une indicible et mâle volupté,avEkyne~disibl|emal@vOlypte.,12
envole-toi bien loin de ces miasmes morbides,AvOl@twabje~lwe~|d@semjasm@mORbid.,13
va te purifier dans l'air supérieur,vat@pyRifje|dAlERsypeRj9R.,12
et bois comme une pure et divine liqueur,ebwakOmyn@pyR|edivin@lik9R.,12
le feu clair qui remplit les espaces limpides,l@f2klERkiRApli|lezEspas@le~pid.,12
derrière les ennuis et les vastes chagrins,dERjER@lezAnHiz|elevast@SagRe~.,12
heureux celui qui peut d'une aile vigoureuse,2R2s@lHikip2|dt|ynEl@viguR2z.,12
s'élancer vers les champs lumineux et sereins ,szelAsevERleSA|lymin2zes@Re~.,12
celui dont les pensers comme des alouettes,s@lHidClepAse|kOm@dezalwEt.,12
vers les cieux le matin prennent un libre essor,vERlesj2l@mate~|pREnte~libResOR.,11
 qui plane sur la vie et comprend sans effort,kiplan@syRlavi|ekCpRAsAzefOR.,12
le langage des fleurs et des choses muettes ,l@lAgaZ@defl9Rz|edeSoz@mHEt.,12
la nature est un temple où de vivants piliers,lanatyREte~tApl|ud@vivApilje.,12
l'homme y passe à travers des forêts de symboles,lOmipasatRavER|defOREd@se~bOl.,12
qui l'observent avec des regards familiers,kilOpsERvtavEkde|R@gaRfamilje.,11
comme de longs échos qui de loin se confondent,kOm@d@lCzeko|kid@lwe~s@kCfCd.,12
dans une ténébreuse et profonde unité,dAzyn@tenebR2z|epROfCdynite.,12
vaste comme la nuit et comme la clarté,vast@kOm@lanHit|ekOm@laklaRte.,12
les parfums les couleurs et les sons se répondent,lepaRfe~lekul9Rz|elesCs@RepCd.,12
il est des parfums frais comme des chairs d'enfants,ilEdepaRfe~fRE|kOm@deSERdtAfA.,12
doux comme les hautbois verts comme les prairies,dukOm@leobwa|vERkOm@lepReRi.,12
 et d'autres corrompus riches et triomphants,edtotR@kORCpy|RiS@zetRijCfA.,13
ayant l'expansion des choses infinies,EjAlEkspAsjC|deSoz@ze~fini.,12
comme l'ambre le musc le benjoin et l'encens,kOm@lAbR@l@mysk|l@b9~Zwe~elAsA.,12
j'aime le souvenir de ces époques nues,ZEm@l@suv@niR|d@sezepOk@ny.,12
dont phœbus se plaisait à dorer les statues,dCfEbyss@plEzEt|adORelestaty.,12
alors l'homme et la femme en leur agilité,alORlOmelafam|Al9RaZilite.,12
jouissaient sans mensonge et sans anxiété,ZwisEsAmAsCZ|esAzAksjete.,12
et le ciel amoureux leur caressant l'échine,el@sjElamuR2|l9RkaResAleSin.,12
exerçaient la santé de leur noble machine,EgzERsElasAte|d@l9RnObl@maSin.,12
cybèle alors fertile en produits généreux,sibElalORfERtil|ApROdHiZeneR2.,12
ne trouvait point ses fils un poids trop onéreux,n@tRuvEpwe~sefilz|e~pwatRoOneR2.,12
mais louve au cœur gonflé de tendresses communes,mEluvok9rgCfle|d@tAdREs@kOmyn.,12
abreuvait l'univers à ses tétines brunes,abR9vElynivERz|asetetin@bRyn.,12
l'homme élégant robuste et fort avait le droit,lOmelegARObyst|efORtavEl@dRwa.,12
d'être fier des beautés qui le nommaient leur roi ,dEtR@fjedebotekil@nOmEl9RRwa.,13
fruits purs de tout outrage et vierges de gerçures,fRHipyRd@tututRaZ|evjERZ@d@ZERsyR.,12
dont la chair lisse et ferme appelait les morsures ,dClaSERlisefERm|ap@lElemORsyR.,12
le poëte aujourd'hui quand il veut concevoir,l@poEtojuRdji|kAtilv2kCs@vwaR.,12
ces natives grandeurs aux lieux où se font voir,senativ@gRAd9Rz|olj2zus@fCvwaR.,12
la nudité de l'homme et celle de la femme,lanydited@lOm|esEl@d@lafam.,12
sent un froid ténébreux envelopper son âme,sAte~fRwatenebR2z|Av@lOpesCam.,12
devant ce noir tableau plein d'épouvantement,d@vAs@nwaRtablo|ple~dtepuvAt@mA.,12
ô monstruosités pleurant leur vêtement ,omCstRyozite|pl9RAl9RvEt@mA.,12
ô ridicules troncs  torses dignes des masques ,oRidikyl@tRC|tORs@dinj@demask.,12
ô pauvres corps tordus maigres ventrus ou flasques,opovR@kORtORdy|mEgR@vAtRyzuflask.,12
que le dieu de l'utile implacable et serein,k@l@dj2d@lytil|e~plakables@Re~.,12
enfants emmaillota dans ses langes d'airain ,AfAzAmajOta|dAselAZ@dtERe~.,12
