et dormir dans l'oubli comme un requin dans l'onde,edORmiRdAlubli|kOme~R@ke~dAlCd.,12
je hais les testaments et je hais les tombeaux ,Z@EletEstamAz|eZ@EletCbo.,12
plutôt que d'implorer une larme du monde,plytok@dte~plORe|yn@laRm@dymCd.,12
vivant j'aimerais mieux inviter les corbeaux,vivAZem@REmj2z|e~vitelekORbo.,12
à saigner tous les bouts de ma carcasse immonde,asenjetuslebu|d@makaRkasimCd.,12
ô vers  noirs compagnons sans oreille et sans yeux,ovERnwaRkCpanjC|sAzOREjesAzj2.,12
voyez venir à vous un mort libre et joyeux ,vwajev@niRavuz|e~mORlibReZwaj2.,12
philosophes viveurs fils de la pourriture,filOzOf@viv9R|fild@lapuRityR.,12
à travers ma ruine allez donc sans remords,atRavERmaRHin|aledCksAR@mOR.,12
et dites-moi s'il est encor quelque torture,edit@mwaszilEt|AkorkElk@tORtyR.,12
pour ce vieux corps sans âme et mort parmi les morts ,puRs@vj2kORsAam|emORpaRmilemOR.,12
la haine est le tonneau des pâles danaïdes ,laEnEl@tOno|depal@danaid.,12
la vengeance éperdue aux bras rouges et forts,lavAZAsepERdy|obRaRuZ@zefOR.,12
a beau précipiter dans ses ténèbres vides,abopResipite|dAsetenEbR@vid.,12
de grands seaux pleins du sang et des larmes des morts,d@gRAsople~dysA|edelaRm@demOR.,12
le démon fait des trous secrets à ces abîmes,l@demCfEdetRu|s@kREzasezabim.,12
par où fuiraient mille ans de sueurs et d'efforts,paRufHiREmilA|d@sH9RzedtefOR.,12
quand même elle saurait ranimer ses victimes,kAmEmEl@soRE|Ranimeseviktim.,12
et pour les ressaigner ressusciter leurs corps,epuRler@sEJe|Resysitel9RkOR.,12
la haine est un ivrogne au fond d'une taverne,laEnEte~ivROnj|ofCdtyn@tavERn.,12
qui sent toujours la soif naître de la liqueur,kisAtuZuRlaswaf|nEtR@d@lalik9R.,12
et se multiplier comme l'hydre de lerne,es@myltiplijekOm@lidR@d@lErn.,13
et la haine est vouée à ce sort lamentable,elaEnEvwe|as@sORlamAtabl.,12
de ne pouvoir jamais s'endormir sous la table,d@n@puvwaRZamE|sz|AdORmiRsulatabl.,12
il est amer et doux pendant les nuits d'hiver,ilEtamERedu|pAdAlenHidivER.,12
d'écouter près du feu qui palpite et qui fume,dtekutepREdyf2|kipalpitekifym.,12
les souvenirs lointains lentement s'élever,lesuv@niRlwe~te~|lAt@mAszel@ve.,12
au bruit des carillons qui chantent dans la brume,obRHidekaRijCkiSAtdAlabRym.,12
bienheureuse la cloche au gosier vigoureux,bje~n9R2z@laklOS|ogozjeviguR2.,12
qui malgré sa vieillesse alerte et bien portante,kimalgResavjEjEs|alERtebje~pORtAt.,12
jette fidèlement son cri religieux,ZEt@fidEl@mA|sCkRiR@liZj2.,12
ainsi qu'un vieux soldat qui veille sous la tente ,e~sike~vj2sOlda|kivEj@sulatAt.,12
moi mon âme est fêlée et lorsqu'en ses ennuis,mwamCamEfEle|eloRskAsezAnHi.,12
elle veut de ses chants peupler l'air froid des nuits,El@v2d@seSA|p9plelERfRwadenHi.,12
il arrive souvent que sa voix affaiblie,ilaRiv@suvA|k@savwazafEbli.,12
semble le râle épais d'un blessé qu'on oublie,sAbl@l@RalepE|dt|e~blesekCubli.,12
au bord d'un lac de sang sous un grand tas de morts,obORdte~lakd@sA|suze~gRAtad@mOR.,12
et qui meurt sans bouger dans d'immenses efforts ,ekim9RsAbuZe|dAdtimAs@zefOR.,12
pluviôse irrité contre la vie entière,plyvjOziRite|kCtR@laviAtjER.,12
de son urne à grands flots verse un froid ténébreux,d@sCyRnagRAflo|vERse~fRwatenebR2.,12
aux pâles habitants du voisin cimetière,opalabitAdy|vwaze~sim@tjER.,11
et la mortalité sur les faubourgs brumeux,elamORtalite|syRlefobuRbRym2.,12
mon chat sur le carreau cherchant une litière,mCSasyRl@kaRo|SERSAtyn@litjER.,12
agite sans repos son corps maigre et galeux ,aZit@sAR@po|sCkORmEgRegal2.,12
avec la triste voix d'un fantôme frileux,avEklatRist@vwa|dt|e~fAtom@fRil2.,12
le bourdon se lamente et la bûche enfumée,l@buRdCs@lamAt|elabySAfyme.,12
accompagne en fausset la pendule enrhumée,akCpanjAfosE|lapAdylARyme.,12
cependant qu'en un jeu plein de sales parfums,s@pAdAkAe~Z2|ple~d@sal@paRfe~.,12
héritage fatal d'une vieille hydropique,eRitaZ@fatal|dt|yn@vjEjidRopik.,12
le beau valet de cœur et la dame de pique,l@bovalEd@k9r|eladam@d@pik.,12
causent sinistrement de leurs amours défunts,kozsinistR@mAd@|l9RzamuRdefe~.,11
j'ai plus de souvenirs que si j'avais mille ans,Zeplyd@suv@niR|k@siZavEmilA.,12
un gros meuble à tiroirs encombré de bilans,e~gRom9blatiRwaRz|AkCbRed@bilA.,12
de vers de billets doux de procès de romances,d@vERd@bijEdu|d@pROsEd@ROmAs.,12
avec de lourds cheveux roulés dans des quittances,avEkd@luRS@v2|RuledAdekitAs.,12
cache moins de secrets que mon triste cerveau,kaS@mwe~d@s@kRE|k@mCtRist@sERvo.,12
c'est une pyramide un immense caveau,sEtyn@piRamid|e~imAs@kavo.,12
qui contient plus de morts que la fosse commune,kikCtje~plyd@mOR|k@lafos@kOmyn.,12
 je suis un cimetière abhorré de la lune,Z@sHize~sim@tjER|abORed@lalyn.,12
je suis un vieux boudoir plein de roses fanées,Z@sHize~vj2budwaR|ple~d@Roz@fane.,12
où gît tout un fouillis de modes surannées,uZitute~fuji|d@mOd@syRane.,12
où les pastels plaintifs et les pâles boucher,ulepastElple~tifz|elepal@buSe.,12
rien n'égale en longueur les boiteuses journées,Rje~negalAlCg9R|lebwat2z@ZuRne.,12
quand sous les lourds flocons des neigeuses années,kAsuleluRflOkC|denEZ2z@zane.,12
l'ennui fruit de la morne incuriosité,lAnHifRHid@lamORn|e~kyRiosite.,12
prend les proportions de l'immortalité,pRAlepROpORsjC|d@limORtalite.,12
 désormais tu n'es plus ô matière vivante ,dezORmEtynEply|omatjER@vivAt.,12
qu'un granit entouré d'une vague épouvante,ke~gRanittAtuRe|dt|yn@vagepuvAt.,12
assoupi dans le fond d'un saharah brumeux ,asupidAl@fC|dt|e~saaRabRym2.,12
un vieux sphinx ignoré du monde insoucieux,e~vj2sfe~kszinjORe|dymCde~susj2.,12
oublié sur la carte et dont l'humeur farouche,ublijesyRla|kaRtedClym9RfaRuS.,13
ne chante qu'aux rayons du soleil qui se couche ,n@SAt@koREjC|dysOlEjkis@kuS.,12
je suis comme le roi d'un pays pluvieux,Z@sHikOm@l@Rwa|dt|e~peiplyvj2.,12
riche mais impuissant jeune et pourtant très-vieux,RiS@mEze~pHisA|Z9nepuRtAtREvj2.,12
qui de ses précepteurs méprisant les courbettes,kid@sepResEpt9R|mepRizAlekuRbEt.,12
s'ennuie avec ses chiens comme avec d'autres bêtes,szAnHiavEkseSje~|kOmavEkdtotR@bEt.,12
rien ne peut l'égayer ni gibier ni faucon,Rje~n@p2legeje|niZibjenifokC.,12
ni son peuple mourant en face du balcon,nisCp9pl@muRAt|Afas@dybalkC.,12
du bouffon favori la grotesque ballade,dybufCfavORi|lagRotEsk@balad.,12
ne distrait plus le front de ce cruel malade ,n@distREplyl@fRC|d@s@kRyElmalad.,12
son lit fleurdelisé se transforme en tombeau,sClifl2Rd@lise|s@tRAsfORmAtCbo.,12
et les dames d'atour pour qui tout prince est beau,eledam@dtatuR|puRkitupRe~sEbo.,12
pour tirer un souris de ce jeune squelette,puRtiRee~suRi|d@s@Z9n@sk@lEt.,12
le savant qui lui fait de l'or n'a jamais pu,l@savAkilHifE|d@lORnaZamEpy.,12
de son être extirper l'élément corrompu,d@sCEtREkstiRpe|l|elemAkORCpy.,12
et dans ces bains de sang qui des romains nous viennent,edAsebe~d@sA|kideROme~nuvjEn.,12
et dont sur leurs vieux jours les puissants se souviennent,edCsyRl9Rvj2ZuR|lepHisAs@suvjEn.,12
il n'a su réchauffer ce cadavre hébété,ilnasyReSofe|s@kadavRebete.,12
où coule au lieu de sang l'eau verte du léthé,ukulolj2d@sA|l|ovERt@dylete.,12
quand le ciel bas et lourd pèse comme un couvercle,kAl@sjElbazeluR|pEz@kOme~kuvERkl.,12
sur l'esprit gémissant en proie aux longs ennuis,syRlEspRiZemisAt|ApRwaolCzAnHi.,12
et que de l'horizon embrassant tout le cercle,ek@d@lORizC|AbRasAtul@sERkl.,12
il nous verse un jour noir plus triste que les nuits ,ilnuvERse~ZuRnwaR|plytRist@k@lenHi.,12
quand la terre est changée en un cachot humide,kAlatERESAZe|Ae~kaSoymid.,12
où l'espérance comme une chauve-souris,ulEspeRAs@kOm|yn@Sov@suRi.,12
s'en va battant les murs de son aile timide,szAvabatAlemyR|d@sCEl@timid.,12
et se cognant la tête à des plafonds pourris ,es@kOnjAlatEt|adeplafCpuRi.,12
quand la pluie étalant ses immenses traînées,kAlaplHietalA|sezimAs@tRene.,12
d'une vaste prison imite les barreaux,dtyn@vast@pRizC|imit@lebaRo.,12
et qu'un peuple muet d'infâmes araignées,eke~p9pl@mHE|dt|e~fam@zaRenje.,12
vient tendre ses filets au fond de nos cerveaux,vje~tAdR@sefilEz|ofCd@nosERvo.,12
des cloches tout à coup sautent avec furie,deklOS@tutaku|sottavEkfyRi.,11
ainsi que des esprits errants et sans patrie,e~sik@dezEspRiz|eRAzesApatRi.,12
qui se mettent à geindre opiniâtrément,kis@mEttaZe~dRopiniatRemA.,11
 et de longs corbillards sans tambours ni musique,ed@lCkORbijaR|sAtAbuRnimyzik.,12
défilent lentement dans mon âme  l'espoir,defillAt@mAdA|mCamlEspwaR.,10
vaincu pleure et l'angoisse atroce despotique,ve~kypl9RelAgwas|atROs@dEspOtik.,12
sur mon crâne incliné plante son drapeau noir,syRmCkRane~kline|plAt@sCdRaponwaR.,12
grands bois vous m'effrayez comme des cathédrales ,gRAbwavumefReje|kOm@dekatedRal.,12
vous hurlez comme l'orgue  et dans nos cœurs maudits,vuyRlekOm@lORg|edAnok9Rmodi.,12
je te hais océan  tes bonds et tes tumultes,Z@t@EzOseA|tebCzetetymylt.,12
mon esprit les retrouve en lui  ce rire amer,mCEspRileR@tRuv|AlHis@RiRamER.,12
de l'homme vaincu plein de sanglots et d'insultes,d@lOm@ve~kyple~|d@sAglozedte~sylt.,12
je l'entends dans le rire énorme de la mer,Z@lAtAdAl@RiR|enORm@d@lamER.,12
comme tu me plairais ô nuit  sans ces étoiles,kOm@tym@plERE|onHisAsezetwal.,12
dont la lumière parle un langage connu ,dClalymjER@paRl|e~lAgaZ@kOny.,12
car je cherche le vide et le noir et le nu ,kaRZ@SERS@l@vid|el@nwaRel@ny.,12
mais les ténèbres sont elles-mêmes des toiles,mEletenEbR@sCt|El@mEm@detwal.,12
des êtres disparus aux regards familiers,deEtR@dispaRyz|oR@gaRfamilje.,12
morne esprit autrefois amoureux de la lutte,mORnEspRitotR@fwaz|amuR2d@lalyt.,12
l'espoir dont l'éperon attisait ton ardeur,lEspwaRdClep@RC|atizEtCaRd9R.,12
ne veut plus t'enfourcher  couche-toi sans pudeur,n@v2plyttAfuRSe|kuS@twasApyd9R.,12
vieux cheval dont le pied à chaque obstacle butte,vj2S@valdCl@pjet|aSakOpstakl@byt.,12
résigne-toi mon cœur  dors ton sommeil de brute,Rezinj@twamCk9r|dORtCsOmEjd@bRyt.,12
esprit vaincu fourbu  pour toi vieux maraudeur,EspRive~kyfuRby|puRtwavj2maRod9R.,12
l'amour n'a plus de goût non plus que la dispute ,lamuRnaplyd@gu|nCplyk@ladispyt.,12
adieu donc chants du cuivre et soupirs de la flûte ,adj2dCkSAdykHivR|esupiRd@laflyt.,12
plaisirs ne tentez plus un cœur sombre et boudeur ,pleziRn@tAteplyz|e~k9rsCbRebud9R.,12
le printemps adorable a perdu son odeur ,l@pRe~tAzadORabl|apERdysCOd9R.,12
et le temps m'engloutit minute par minute,el@tAmAgluti|minyt@paRminyt.,12
comme la neige immense un corps pris de roideur ,kOm@lanEZimAs|e~kORpRid@Rwad2R.,12
je contemple d'en haut le globe en sa rondeur,Z@kCtApl@dtAo|l@glObAsaRCd9R.,12
et je n'y cherche plus l'abri d'une cahute ,eZ@niSERS@ply|l|abRidtyn@kayt.,12
avalanche veux-tu m'emporter dans ta chute ,avalAS@v2ty|m|ApORtedAtaSyt.,12
horloge  dieu sinistre effrayant impassible,ORlOZ@dj2sinistR|efRejAte~pasibl.,12
dont le doigt nous menace et nous dit   ,dCl@dwanum@nas|enudi.,9
les vibrantes douleurs dans ton cœur plein d'effroi,levibRAt@dul9R|dAtCk9rple~dtefRwa.,12
se planteront bientôt comme dans une cible ,s@plAt@RCbje~to|kOm@dAzyn@sibl.,12
le plaisir vaporeux fuira vers l'horizon,l@pleziRvapOR2|fHiRavERlORizC.,12
ainsi qu'une sylphide au fond de la coulisse ,e~sikyn@silfid|ofCd@lakulis.,12
chaque instant te dévore un morceau du délice,Sake~stAt@devOR|e~mORsodydelis.,12
à chaque homme accordé pour toute sa saison,aSakOmakORde|puRtut@sasEzC.,12
trois mille six cents fois par heure la seconde,tRwamil@sissAfwa|paR9R@las@gCd.,12
chuchote  ,SySOt.,2
d'insecte maintenant dit  je suis autrefois,dte~sEkt@me~t@nA|diZ@sHizotR@fwa.,12
et j'ai pompé ta vie avec ma trompe immonde ,eZepCpetavi|avEkmatRCpimCd.,12
mon gosier de métal parle toutes les langues,mCgozjed@metal|paRl@tut@lelAg.,12
les minutes mortel folâtre sont des gangues,leminyt@mORtEl|fOlatR@sCdegAg.,12
qu'il ne faut pas lâcher sans en extraire l'or ,kiln@fopalaSe|sAzAEkstRER@lOR.,12
qui gagne sans tricher à tout coup  c'est la loi,kiganj@sAtRiSe|atukusElalwa.,12
le jour décroît  la nuit augmente  ,l@ZuRdekRwalanHit|OgmAt.,8
le gouffre a toujours soif  la clepsydre se vide,l@gufRatuZuRswaf|laklEpsidR@s@vid.,12
tantôt sonnera l'heure où le divin hasard,tAtosOn@Ral9R|ul@dive~azaR.,12
où l'auguste vertu ton épouse encor vierge,ulogyst@vERty|tCepuzAkorvjERZ.,12
où le repentir même oh  la dernière auberge ,ul@R@pAtiRmEm|oladERnjERobERZ.,12
où tout te dira  meurs vieux lâche  il est trop tard  ,utut@diRam9R|vj2laSilEtRotaR.,12
je veux pour composer chastement mes églogues,Z@v2puRkCpoze|Sast@mAmezeglog.,12
coucher auprès du ciel comme les astrologues,kuSeopREdysjEl|kOm@lezastROlOg.,12
et voisin des clochers écouter en rêvant,evwaze~deklOSez|ekuteARevA.,12
leurs hymnes solennels emportés par le vent,l9Rimn@sOlanElz|ApORtepaRl@vA.,12
les deux mains au menton du haut de ma mansarde,led2me~zomAtC|dyod@mamAsaRd.,12
je verrai l'atelier qui chante et qui bavarde ,Z@vERelat@lje|kiSAtekibavaRd.,12
les tuyaux les clochers ces mâts de la cité,letHijoleklOSe|semad@lasite.,12
et les grands ciels qui font rêver d'éternité,elegRAsjElkifC|RevedtetERnite.,12
il est doux à travers les brumes de voir naître,ilEduzatRavER|lebRym@d@vwaRnEtR.,12
l'étoile dans l'azur la lampe à la fenêtre,letwal@dAlazyR|lalApalaf@nEtR.,12
les fleuves de charbon monter au firmament,lefl9v@d@SaRbC|mCteofiRmamA.,12
et la lune verser son pâle enchantement,elalyn@vERse|sCpalASAt@mA.,12
je verrai les printemps les étés les automnes ,Z@vERelepRe~tA|lezetelezOtOn.,12
et quand viendra l'hiver aux neiges monotones,ekAvje~dRalivER|onEZ@mOnOtOn.,12
je fermerai partout portières et volets,Z@fERm@RepaRtu|pORtjER@zevOlE.,12
pour bâtir dans la nuit mes féeriques palais,puRbatiRdAlanHi|mefeeRik@palE.,13
alors je rêverai des horizons bleuâtres,alORZ@Rev@Re|deORizCbl2atR.,12
des jardins des jets d'eau pleurant dans les albâtres,deZaRde~deZEdto|pl9RAdAlezalbatR.,12
des baisers des oiseaux chantant soir et matin,debezedezwazo|SAtAswaRemate~.,12
et tout ce que l'idylle a de plus enfantin,etus@k@lidil|ad@plyzAfAte~.,12
l'émeute tempêtant vainement à ma vitre,lem2t@tApetA|vEn@mAtamavitR.,12
ne fera pas lever mon front de mon pupitre ,n@f@Rapal@ve|mCfRCd@mCpypitR.,12
car je serai plongé dans cette volupté,kaRZ@s@ReplCZe|dAsEt@vOlypte.,12
d'évoquer le printemps avec ma volonté,dtevOkel@pRe~tAz|avEkmavOlCte.,12
de tirer un soleil de mon cœur et de faire,d@tiRee~sOlEj|d@mCk9red@fER.,12
de mes pensers brûlants une tiède atmosphère,d@mepAsebRylAz|yn@tjEdatmOsfER.,12
le long du vieux faubourg où pendent aux masures,l@lCdyvj2fobuR|upAdtomazyR.,11
les persiennes abri des secrètes luxures,lepERsjEn@zabRi|des@kREt@lyksyR.,12
quand le soleil cruel frappe à traits redoublés,kAl@sOlEjkRyEl|fRapatRER@duble.,12
sur la ville et les champs sur les toits et les blés,syRlavileleSA|syRletwazeleble.,12
je vais m'exercer seul à ma fantasque escrime,Z@vEmEgzERses9l|amafAtaskEskRim.,12
flairant dans tous les coins les hasards de la rime,fleRAdAtuslekwe~|leazaRd@laRim.,12
trébuchant sur les mots comme sur les pavés,tRebySAsyRlemo|kOm@syRlepave.,12
heurtant parfois des vers depuis longtemps rêvés,9RtApaRfwadevER|d@pHilCtAReve.,12
ce père nourricier ennemi des chloroses,s@pER@nuRisje|En@mideSlorOz.,12
éveille dans les champs les vers comme les roses ,evej@dAleSA|levERkOm@leRoz.,12
il fait s'évaporer les soucis vers le ciel,ilfEszevapORe|lesusivERl@sjEl.,12
et remplit les cerveaux et les ruches de miel,eRAplilesERvoz|eleRyS@d@mjEl.,12
c'est lui qui rajeunit les porteurs de béquilles,sElHikiRaZ9ni|lepORt9Rd@bekij.,12
et les rend gais et doux comme des jeunes filles,eleRAgezedu|kOm@deZ9n@fij.,12
et commande aux moissons de croître et de mûrir,ekOmAdomwasC|d@kRwatRed@myRiR.,12
dans le cœur immortel qui toujours veut fleurir ,dAl@k9rimORtEl|kituZuRv2fl9RiR.,12
quand ainsi qu'un poëte il descend dans les villes,kAte~sike~poEt|ildesAdAlevil.,12
il ennoblit le sort des choses les plus viles,ilAnOblil@sOR|deSoz@leplyvil.,12
et s'introduit en roi sans bruit et sans valets,esze~tROdHitARwa|sAbRHitesAvalE.,13
dans tous les hôpitaux et dans tous les palais,dAtusleOpitoz|edAtuslepalE.,12
andromaque je pense à vous   ce petit fleuve,Adromak@Z@pAs|avus@p@tifl9v.,12
pauvre et triste miroir où jadis resplendit,povRetRist@miRwaR|uZadisREsplAdi.,12
l'immense majesté de vos douleurs de veuve,limAs@maZEste|d@vodul9Rd@v9v.,12
ce simoïs menteur qui par vos pleurs grandit,s@simoismAt9R|kipaRvopl9RgRAdi.,12
a fécondé soudain ma mémoire fertile,afekCdesude~|mamemwaR@fERtil.,12
comme je traversais le nouveau carrousel,kOm@Z@tRavERsE|l@nuvokaRuzEl.,12
 le vieux paris n'est plus la forme d'une ville,l@vj2paRinEply|lafORm@dtyn@vil.,12
change plus vite hélas  que le cœur d'un mortel ,SAZ@plyvitelas|k@l@k9rdte~mORtEl.,12
je ne vois qu'en esprit tout ce camp de baraques,Z@n@vwakAEspRi|tus@kAd@baRak.,12
ces tas de chapiteaux ébauchés et de fûts,setad@Sapitoz|eboSezed@fy.,12
les herbes les gros blocs verdis par l'eau des flaques,leERb@legRoblOk|vERdipaRlodeflak.,12
et brillant aux carreaux le bric-à-brac confus,ebRijAtokaRo|l@bRikakCfy.,11
là s'étalait jadis une ménagerie ,laszetalEZadisz|yn@menaZ@Ri.,12
là je vis un matin à l'heure où sous les cieux,laZ@visze~mate~|al9Rusulesj2.,12
clairs et froids le travail s'éveille où la voirie,klERzefRwal@tRavaj|sz|evejulavwaRi.,12
pousse un sombre ouragan dans l'air silencieux,puse~sCbRuRagA|dAlERsilAsj2.,12
un cygne qui s'était évadé de sa cage,e~sinj@kiszetEt|evaded@sakaZ.,12
et de ses pieds palmés frottant le pavé sec,ed@sepjepalme|fROtAl@pavesEk.,12
sur le sol raboteux traînait son blanc plumage,syRl@sOlRabOt2|tRenEsCblAplymaZ.,12
près d'un ruisseau sans eau la bête ouvrant le bec,pREdte~RHisosAzo|labEtuvRAl@bEk.,12
baignait nerveusement ses ailes dans la poudre,benjEnERv2z@mA|sezEl@dAlapudR.,12
et disait le cœur plein de son beau lac natal ,edizEl@k9rple~|d@sCbolaknatal.,12
 eau quand donc pleuvras-tu  quand tonneras-tu foudre  ,okAdCkpl2vRaty|kAtOn@RatyfudR.,12
je vois ce malheureux mythe étrange et fatal,Z@vwas@mal2R2|mitetRAZefatal.,12
vers le ciel quelquefois comme l'homme d'ovide,vERl@sjElkElk@fwa|kOm@lOm@dtovid.,12
vers le ciel ironique et cruellement bleu,vERl@sjEliROnik|ekRyEl@mAbl2.,12
sur son cou convulsif tendant sa tête avide,syRsCkukCvylsif|tAdAsatEtavid.,12
comme s'il adressait des reproches à dieu ,kOm@sziladResE|deR@pROS@zadj2.,12
paris change  mais rien dans ma mélancolie,paRiSAZ@mERje~|dAmamelAkOli.,12
n'a bougé  palais neufs échafaudages blocs,nabuZepalEn9fz|eSafodaZ@blOk.,12
vieux faubourgs tout pour moi devient allégorie,vj2fobuRtupuRmwa|d@vje~talegORi.,12
et mes chers souvenirs sont plus lourds que des rocs,emeSERsuv@niR|sCplyluRk@deROk.,12
aussi devant ce louvre une image m'opprime ,osid@vAs@luvR|ynimaZ@mOpRim.,12
je pense à mon grand cygne avec ses gestes fous,Z@pAsamCgRAsinj|avEkseZEst@fu.,12
comme les exilés ridicule et sublime,kOm@lezEgzile|Ridikylesyblim.,12
et rongé d'un désir sans trêve  et puis à vous,eRCZedte~deziR|sAtREvepHizavu.,12
andromaque des bras d'un grand époux tombée,Adromak@debRa|dt|e~gRAteputCbe.,12
vil bétail sous la main du superbe pyrrhus,vilbetajsulame~|dysypERb@piRys.,12
auprès d'un tombeau vide en extase courbée ,opREdte~tCbovid|AEkstaz@kuRbe.,12
veuve d'hector hélas  et femme d'hélénus ,v9v@dektoRelasz|efam@delenus.,12
je pense à la négresse amaigrie et phtisique,Z@pAsalanegREs|amEgRieftizik.,12
piétinant dans la boue et cherchant l'œil hagard,pjetinAdAlabu|eSERSAl2jagaR.,12
les cocotiers absents de la superbe afrique,lekOkOtjezapsA|d@lasypERbafRik.,12
derrière la muraille immense du brouillard ,dERjER@lamyRaj|imAs@dybRujaR.,12
à quiconque a perdu ce qui ne se retrouve,akikCkapERdy|s@kin@s@R@tRuv.,12
aux maigres orphelins séchant comme des fleurs ,omEgR@zORf@le~|seSAkOm@defl9R.,12
ainsi dans la forêt où mon esprit s'exile,e~sidAlafOREt|umCEspRiszEgzil.,12
un vieux souvenir sonne à plein souffle du cor ,e~vj2suv@niRsOn|aple~sufl@dykOR.,12
je pense aux matelots oubliés dans une île,Z@pAsomat@loz|ublijedAzyn@il.,14
aux captifs aux vaincus  à bien d'autres encor ,okaptifzove~kyz|abje~dtotR@zAkor.,12
fourmillante cité cité pleine de rêves,furmijAnt@site|siteplEn@d@REv.,12
où le spectre en plein jour raccroche le passant ,ul@spEktRAple~ZuR|RakROS@l@pasA.,12
dans les canaux étroits du colosse puissant,dAlekanozetRwa|dykOlOs@pHisA.,12
un matin cependant que dans la triste rue,e~mate~s@pAdA|k@dAlatRist@Ry.,12
les maisons dont la brume allongeait la hauteur,lemEzCdClabRym|alCZElaot9R.,12
simulaient les deux quais d'une rivière accrue,simylEled2ke|dt|yn@RivjERakRy.,12
un brouillard sale et jaune inondait tout l'espace,e~bRujaRsaleZon|inCdEtulEspas.,12
je suivais roidissant mes nerfs comme un héros,Z@sHivERwadisA|menERkOme~eRo.,12
le faubourg secoué par les lourds tombereaux,l@fobuRs@kwe|paRleluRtCb@Ro.,12
tout à coup un vieillard dont les guenilles jaunes,tutakue~vjEjaR|dCleg@nij@Zon.,12
imitaient la couleur de ce ciel pluvieux,imitElakul9R|d@s@sjElplyvj2.,12
et dont l'aspect aurait fait pleuvoir les aumônes,edClaspEtORE|fEpl2vwaRlezomon.,12
sans la méchanceté qui luisait dans ses yeux,sAlameSAs@te|kilHizEdAsezj2.,12
m'apparut on eût dit sa prunelle trempée,mapaRytCydi|sapRynEl@tRApe.,12
dans le fiel  son regard aiguisait les frimas,dAl@fjElsCR@gaRt|egizElefRima.,12
et sa barbe à longs poils roide comme une épée,esabaRbalCpwal|Rwad@kOmynepe.,12
se projetait pareille à celle de judas,s@pROZ@tEpaREj|asEl@d@Zyda.,12
il n'était pas voûté mais cassé son échine,ilnetEpavute|mEkasesCeSin.,12
faisant avec sa jambe un parfait angle droit,f@zAtavEksaZAb|e~paRfEtAgl@dRwa.,12
si bien que son bâton parachevant sa mine,sibje~k@sCbatC|paRaS@vAsamin.,12
lui donnait la tournure et le pas maladroit,lHidOnElatuRnyR|el@pamaladRwa.,12
d'un quadrupède infirme ou d'un juif à trois pattes,dte~kwadRypEde~fiRm|udte~ZHifatRwapat.,12
dans la neige et la boue il allait s'empêtrant,dAlanEZelabu|ilalEszApEtRA.,12
comme s'il écrasait des morts sous ses savates,kOm@szilekRazE|demORsusesavat.,12
hostile à l'univers plutôt qu'indifférent,OstilalynivER|plytoke~difeRA.,12
son pareil le suivait  barbe œil dos bâton loques,sCpaREjl@sHivE|baRb@2jdobatClOk.,13
nul trait ne distinguait du même enfer venu,nyltREn@diste~gE|dymEmAfERv@ny.,12
ce jumeau centenaire et ces spectres baroques,s@ZymosAt@nER|esespEktR@baROk.,12
marchaient du même pas vers un but inconnu,maRSEdymEm@pa|vERze~bytte~kOny.,12
à quel complot infâme étais-je donc en butte,akElkCplote~fam|etEZ@dCkAbyt.,12
ou quel méchant hasard ainsi m'humiliait ,ukElmeSAazaRt|e~simymiljE.,12
car je comptai sept fois de minute en minute,kaRZ@kCtesEtfwa|d@minytAminyt.,12
ce sinistre vieillard qui se multipliait ,s@sinistR@vjEjaR|kis@myltiplijE.,13
que celui-là qui rit de mon inquiétude,k@s@lHilakiRi|d@mCe~kjetyd.,12
et qui n'est pas saisi d'un frisson fraternel,ekinEpasezi|dt|e~fRisCfRatERnEl.,12
songe bien que malgré tant de décrépitude,sCZ@bje~k@malgRe|tAd@dekRepityd.,12
aurais-je sans mourir contemplé le huitième,OREZ@sAmuRiR|kCtAplel@HitjEm.,12
sosie inexorable ironique et fatal,sOziinEgzORabl|iROnikefatal.,12
dégoûtant phénix fils et père de lui-même ,degutASeniksfilz|epER@d@lHimEm.,12
 mais je tournai le dos au cortège infernal,mEZ@tuRnel@doz|okORtEZe~fERnal.,12
exaspéré comme un ivrogne qui voit double,EgzaspeRekOme~|ivROnj@kivwadubl.,12
je rentrai je fermai ma porte épouvanté,Z@RAtReZ@fERme|mapORtepuvAte.,12
malade et morfondu l'esprit fiévreux et trouble,malademORfCdy|l|EspRifjevR2zetRubl.,12
blessé par le mystère et par l'absurdité ,blesepaRl@mistER|epaRlapsyRdite.,12
vainement ma raison voulait prendre la barre ,vEn@mAmaREzC|vulEpRAdR@labaR.,12
la tempête en jouant déroutait ses efforts,latApEtAZwA|deRutEsezefOR.,12
sans mâts sur une mer monstrueuse et sans bords ,sAmasyRyn@mER|mCstRy2zesAbOR.,12
dans les plis sinueux des vieilles capitales,dAleplisinH2|devjEj@kapital.,12
où tout même l'horreur tourne aux enchantements,utumEm@lOR9R|tuRnozASAt@mA.,12
je guette obéissant à mes humeurs fatales,Z@gEtObeisAt|ameym9Rfatal.,12
des êtres singuliers décrépits et charmants,deEtR@se~gylje|dekRepizeSaRmA.,12
éponine ou laïs   monstres brisés bossus,eponinulais|mCstR@bRizebOsy.,12
ou tordus aimons-les  ce sont encor des âmes,utORdyzemCle|s@sCtAkordeam.,12
sous des jupons troués et sous de froids tissus,sudeZypCtRuez|esud@fRwatisy.,12
frémissant au fracas roulant des omnibus,fRemisAtofRaka|RulAdezOmnibys.,12
et serrant sur leur flanc ainsi que des reliques,eseRAsyRl9RflA|e~sik@deR@lik.,12
un petit sac brodé de fleurs ou de rébus ,e~p@tisakbROde|d@fl9Rzud@Rebys.,12
où se pend un démon sans pitié  tout cassés,us@pAte~demC|sApitjetukase.,12
qu'ils sont ils ont des yeux perçants comme une vrille,kilsCtilzCdezj2|pERsAkOmyn@vRij.,12
luisants comme ces trous où l'eau dort dans la nuit ,lHizAkOm@setRuz|ulodORdAlanHi.,12
ils ont les yeux divins de la petite fille,ilzClezj2dive~|d@lap@tit@fij.,12
qui s'étonne et qui rit à tout ce qui reluit,kiszetOnekiRit|atus@kiR@lHi.,12
 avez-vous observé que maints cercueils de vieilles,avevuzOpsERve|k@me~sERk9jd@vjEj.,12
sont presque aussi petits que celui d'un enfant ,sCpREskosip@ti|k@s@lHidte~AfA.,12
la mort savante met dans ces bières pareilles,lamORsavAt@mE|dAsebjER@paREj.,12
un symbole d'un goût bizarre et captivant,e~se~bOl@dte~gu|bizaRekaptivA.,12
et lorsque j'entrevois un fantôme débile,elORsk@ZAtR@vwaz|e~fAtom@debil.,12
traversant de paris le fourmillant tableau,tRavERsAd@paRi|l@fuRmijAtablo.,12
il me semble toujours que cet être fragile,ilm@sAbl@tuZuR|k@sEtEtR@fRaZil.,12
s'en va tout doucement vers un nouveau berceau ,szAvatudus@mA|vERze~nuvobERso.,12
à moins que méditant sur la géométrie,amwe~k@meditA|syRlaZeOmetRi.,12
je ne cherche à l'aspect de ces membres discords,Z@n@SERSalaspE|d@semAbR@discoRd.,12
combien de fois il faut que l'ouvrier varie,kCbje~d@fwazilfo|k@luvRijevaRi.,13
