et lorsqu'au pied du lit tombent ses longs cheveux,eloRskopjedyli|tCb@selCS@v2,12
il lui dit doucement   mon âme dormez-vous  ,illHididus@mA@mCam@dORmevu,13
cachent de longs tourments et des vœux insensés,kaS@d@lCtuRmAz|edev2ze~sAse,12
vous me répondriez peut-être  je le sais,vum@RepCdRijep2EtR@Z@l@sE,13
vous me défendriez peut-être de vous voir,vum@defAdRijep2EtR@d@vuvwaR,13
je vous sens dans mes bras plier comme un roseau,Z@vusAdAmebRa|plijekOme~Rozo,13
couvrent au loin les bords au matin si sacrés ,kuvRtolwe~lebORzo|mate~sisakRe,11
le mal qu'on savait moins se révèle à toute heure,l@malkCsavEmwe~|s@RevEla9R,13
quand chloé pâlissait auprès de lydia,kAkloepalisEt|opREd@lidja,11
lydia qu'on vantait dans l'italie entière,lidjakCvAtEdA|l|italiAtjER,11
que dans les bras d'un dieu la romaine ilia,k@dAlebRadte~dj2|laROmEnilja,11
plus prompt à l'irriter que l'âpre adriatique ,plypRCtaliRite|k@lapRadRjatik,11
j'ai souhaité d'avoir quelque gloire en partage,ZeswetedtavwaRkElk@glwaRApaRtaZ,11
les battements du cœur qui durent un moment,lebat@mAdyk9r|kidyRte~mOmA,11
le fils du titien pour la rendre immortelle,l@fildytitje~puR|laRAdRimORtEl,11
sur un bel axe d'or la tenir balancée,syRe~bElaksdtORla|t@niRbalAse,11
eut cet homme si fier en sa naïveté,ysEtOm@sifjeAsanaiv@te,13
et je me demandais  est-ce assez d'admirer ,eZ@m@d@mAdEz|Es@asedtadmiRe,13
est-ce assez de venir un soir par aventure,Es@ased@v@niRe~swaRpaRavAtyR,13
çà et là toutefois lorgnant la galerie,saelatutfwalORnjAlagal@Ri,11
un vers d'andré chénier chanta dans ma mémoire,e~vERdtAdReSeniESAtadAmamemwaR,13
et l'effroyable honte où la muse est tombée ,elefRwajablCtu|lamyzEtCbe,11
celui qui l'ose dire est toujours écouté,s@lHikilozdiRE|tuZuRzekute,11
apprends-moi de quel ton dans la bouche hardie,apRAmwad@kEltC|dAlabuSaRdi,11
j'en aurai le courage et l'indignation ,ZAORel@kuRaZ|ele~dinjasjC,13
se voilèrent  la main glissa dans le manchon ,s@vwalER@lame~|glisadAl@mASC,12
a quoi nous servent donc tant de luttes frivoles,akwanusERv@dCk|tAd@lyt@fRivOl,12
vous avez le même âge et le même génie,vuzavel@mEmaZ|el@mEm@Zeni,12
ne réveillent les morts de leur repos sanglant,n@Revej@lemOR|d@l9RR@posAglA,12
comme un essaim d'oiseaux chante au bruit de mes pas,kOme~ese~dtwazo|SAtobRHid@mepa,13
sortent sous tes rayons tous les parfums du jour ,sORt@suteREjC|tuslepaRfe~dyZuR,12
que viennent étaler sur leurs amours passées,k@vjEntetalesyR|l9RzamuRpase,11
et faut-il l'oublier du moment qu'il fait nuit ,efotillublijedymOmA@kilfEnHi,14
est-ce bien toi grande âme immortellement triste,Es@bje~twagRAdam|imORtEl@mA@tRist,13
dans la cendre brûlante où dorment ses ennuis,dAlasAdR@bRylAt|udORm@sezAnHi,12
dans ce passé perdu quand son âme se noie,dAs@pasepERdy|kAsCam@s@nwa,12
vers quelque monument d'un amour oublié,vERkElk@mOnymA@dte~amuRublije,14
el vous criez alors que la vie est un songe,ElvukRijealORk@laviEte~sCZ,13
malheureux  cet instant où votre âme engourdie,mal2R2sEtte~stAt|uvOtRamAguRdi,12
que demandent au ciel ces regrets inconstants,k@d@mAdtosjElse|R@gREze~kCstA,11
que deux êtres mortels échangèrent sur terre,k@d2EtR@mORtElz|eSAZER@syRtER,12
ils prirent à témoin de leur joie éphémère,ilpRiRtatemwe~d@|l9RZwaefemER,11
la fleur entre leurs mains l'insecte sous leurs piés,lafl9RAtR@l9Rme~|l|e~sEkt@sul9Rpie,13
 insensés  dit le sage  heureux  dit le poëte,e~sAsedil@2R2dil@poEt,13
si le bruit du torrent te trouble et t'inquiète,sil@bRHidytORA@t@tRublette~kjEt,14
que juliette morte au fond de son tombeau,k@ZyljEt@mORto|fCd@sCtCbo,11
ses lèvres s'entr'ouvraient et c'était un sourire,selEvR@szAntresetEte~suRiR,10
et j'aurais pu crier  qu'as-tu fait infidèle,eZOREpykRijekastyfEte~fidEl,13
eh bien  qu'importe encore  o nature  ô ma mère ,ebje~ke~pORtAkOR|onatyR@omamER,13
je me dis seulement  a cette heure en ce lieu,Z@m@dis9l@mAt|a9RAs@lj2,13
c'est alfred direz-vous ou le diable m'emporte ,sEtalfReddiRevuz|ul@djabl@mApORt,13
par de plus fiers que moi qui l'imitent encore ,paRd@plyfjERk@mwa|kilimittAkOR,11
or je me demandais hier dans la solitude ,ORZ@m@d@mAdE|jERdAlasOlityd,13
ensuite un mal honteux le bruit de la monnaie,AsHite~malCt2|l@bRHid@lamOnE,13
ceux qui disent  ma sœur ne vois-tu rien venir ,s2kidiz@mas2R|n@vwatyRje~v@niR,12
gaîté génie heureux qui fut jadis le nôtre,gete2R2kifyZadisl@notR,13
comme dit figaro  qui trompe-t-on ici ,kOm@difigaRo|kitRCp@ttisi,11
d'ailleurs est-ce un plaisir d'exprimer sa pensée ,dtaj9RzEs@e~pleziRdtEkspRimesapAse,13
et qu'à la longue en poste un tête-à-tête ennuie,ekalalCgApost|e~tEtaAnHi,11
et de ce bruit honteux qui salit la pensée,ed@s@bRHiCt2kisalilapAse,13
toujours fier et trompé toujours humble et rêvant,tuZuRfjeetRCpetuZuRe~bleRevA,13
mais quel bien fait le bruit et qu'importe la gloire ,mEkElbje~fEl@bRHiteke~pORt@laglwaR,13
vive le vieux roman vive la page heureuse,viv@l@vj2ROmA|viv@la9R2z,13
et que tous les pédants frappent leur tête creuse,ek@tuslepedA|fRap@l9RtEt@kR2z,12
plus fou qu'ophélia de romarin coiffée,plyfukofejad@|ROmaRe~kwafe,11
marcher prier pleurer des larmes ruisselantes,maRSepRijepl9RedelaRm@RHis@lAt,13
el lu mourus aussi seul l'âme désolée,EllymuRyzosi|s9llam@dezOle,12
le meilleur qui nous reste est un ancien ami,l@mEj9RkinuREst|Ete~Asje~ami,13
a peine si le prince hier enseveli,apEn@sil@jERAs@v@li,13
ce fut un triste bruit quand au glas funéraire,s@fyte~tRist@bRHikAtoglafyneRER,13
les faiseurs de romans se mirent à chanter,lef@z9Rd@ROmA|s@miRtaSAte,11
et traversent ainsi la terre désolée,etRavERste~sila|tER@dezOle,11
ménage obscurément ceux qui savent te plaire,menaZOpskyRemA@s2kisav@t@plER,13
ne prenaient de repos que le temps de prier,n@pR@nE@d@R@pok@l@tAd@pRije,14
frissonnent tout à coup et retombent glacées,fRisOn@tutaku|eR@tCb@glase,12
qu'importe tel parti qui triomphe ou succombe ,ke~pORt@tElpaRti|kitRijCfusykCb,13
quel ennemi du père ose haïr le fils ,kElEn@midypER|ozaiRl@fil,11
que les anges muets apprennent aux mourants,k@lezAZ@mHEz|apREntomuRA,11
il vivait avec nous il était de notre âge,ilvivEtavEknuz|iletEd@nOtRaZ,12
sa pensée était jeune avec l'ancien courage ,sapAseetEZ9n|avEklAsje~kuRaZ,13
une heure qu'est-ce donc qu'une heure pour le temps ,9R@kEs@|dCkk9R@puRl@tA,14
une heure a détourné tout un siècle o misère ,9RadetuRnetute~sjEklomizER,13
une heure lui restait il était fils et père ,9R@lHiREstEtiletEfilzepER,13
nous croyions l'heure prête et le moment venu ,nukRwajiCl9R@|pREtel@mOmA@v@ny,14
car la france hier encor la maîtresse du monde,kaRlajER|AkorlamEtREs@dymCd,14
et comme juliette au fond des noirs arceaux,ekOm@ZyljEto|fCdenwaRzaRso,11
ainsi fut mon appel de votre âme entendu,e~sifymCapEl|d@vOtRamAtAdy,12
ce charme triste et doux tant aimé d'un autre âge,s@SaRm@tRistedu|tAtemedte~otRaZ,12
lorsque du maître à tous la vieille hardiesse,lORsk@dymEtRatus|lavjEjaRdjEs,11
je ne sais  dieu le sait  dans la pauvre âme humaine,Z@n@sEdj2l@sE|dAlapovRamymEn,12
dieu défend d'oublier les petits ici-bas,dj2defAdtublijelep@tizisiba,13
petit livre et songer qu'il le faut soutenir,p@tilivResCZe|k|ill@fosutniR,11
les chasseurs de chamois en savent quelque chose,leSas9Rd@Samwaz|Asav@kElk@Soz,12
peut-être en savent-ils autant et plus que nous,p2EtRAsavtilzotAteplyk@nu,11
dorment dans un repos si superbe et si doux,dORm@dAze~R@po|sisypERbesidu,12
tout s'en va les plaisirs et les mœurs d'un autre âge,tuszAvalepleziRz|elem2Rsdte~otRaZ,12
les rois les dieux vaincus le hasard triomphant,leRwaledj2ve~ky|l@azaRtRijCfA,13
rosalinde et suzon qui me trouvent trop sage,Rozale~desyzC|kim@tRuv@tRosaZ,12
mes meilleurs ennemis me conseillent d'en faire,memEj2RzEn@mi|m@kCsej@dtAfER,12
si deux noms par hasard s'embrouillent sur ma lyre,sid2nCpaRazaR|sz|AbRuj@syRmaliR,12
